{
  "schemaVersion": 1,
  "boardId": "nucleo-h563zi",
  "cpu": "stm32h563",
  "boardRevision": "NUCLEO-H563ZI / MB1404 C01 schematic identified; drawing not yet inspected; sprite connector IDs do not match verified headers",
  "electricalMapStatus": "signal-mapping-verified; artwork-anchor-pending",
  "sources": [
    {
      "kind": "manufacturer-firmware-example",
      "url": "https://github.com/STMicroelectronics/STM32CubeH5/blob/bac48badf93cb496f6445afba956082490d3f543/Projects/NUCLEO-H563ZI/Examples/SPI/SPI_FullDuplex_ComIT_Slave/README.md",
      "revision": "bac48badf93cb496f6445afba956082490d3f543",
      "evidence": "Board setup connects PA5 at CN7 pin 10 and PA6 at CN9 pin 1."
    },
    {
      "kind": "manufacturer-document-index",
      "url": "https://github.com/Open-CMSIS-Pack/ST_NUCLEO-H563ZI_BSP/blob/6df9cce5bfaa9cd744fc04df5a96fe01c977b6c1/Documents/README.md",
      "revision": "6df9cce5bfaa9cd744fc04df5a96fe01c977b6c1",
      "evidence": "ST identifies the board as MB1404 and links the C01 schematic pack. The schematic drawing itself has not been reviewed in this worktree."
    }
  ],
  "contacts": [
    {
      "connectorId": "CN7",
      "physicalPadNumber": 10,
      "socPad": "PA5",
      "peripheralFunctions": ["GPIO"],
      "signalMappingVerified": true,
      "artworkAnchorVerified": false,
      "electricalEnabled": false
    },
    {
      "connectorId": "CN9",
      "physicalPadNumber": 1,
      "socPad": "PA6",
      "peripheralFunctions": ["GPIO"],
      "signalMappingVerified": true,
      "artworkAnchorVerified": false,
      "electricalEnabled": false
    }
  ],
  "review": {
    "reviewer": "Codex",
    "reviewedAt": "2026-10-23",
    "note": "The official firmware example verifies signal-to-header mappings, and ST's board-document index identifies the MB1404 C01 schematic. The supplied sprite layout has CN11/CN12 and ZIO_D/ZIO_A identifiers, but no CN7/CN9 contacts; its README calls connector identities and geometry provisional. The schematic drawing and artwork anchors have not been reconciled; both contacts remain electrically disabled."
  }
}
